title,url,description,date,time_crawl,text
17-year-old boy dies at Polmont Young Offenders Institution,https://www.bbc.com/news/articles/c4nge5rzv48o#1,"The boy, who took his own life, was in the facility years after the government pledged to stop sending under-18s to Polmont.","Wed, 17 Jul 2024 16:01:46 GMT",2024-07-17 16:47:11.884141,"['A 17-year-old boy has died at Polmont Young Offenders Institution two years after the government pledged to stop sending under-18s to the facility.The Scottish Prison Service confirmed that Jonathan Beadle died on Saturday. The BBC understands he took his own life.A fatal accident inquiry - which is mandatory for any death in custody - will be held to examine the circumstances.A prison service spokesperson said: “Every death, whether in prison custody or in our communities, is a tragedy for all those who knew and supported the individual.“Following the death of someone in our care, Police Scotland are advised, and the matter reported to the Procurator Fiscal. Fatal accident inquiries are held in due course.”The 17-year-old was sent to Polmont after pleading guilty to a charge of acting in a disorderly manner and being in possession of weapons with intent to ""assault and murder"" a 16-year-old girl.He had put an airgun, shovel, wrench, duct tape and rope in the boot of a car as he went looking for the girl in Moray in March last year.While the case was ongoing, he stayed in a secure children’s unit before being moved to Polmont.Police Scotland said officers had been made aware of the death of a 17-year-old at Polmont and it was not thought to be suspicious.', 'The Scottish government said in March 2022 that 16 and 17-year-olds would no longer be placed in young offenders institutions.It said it wanted to end the placement of under-18s in custody ""without delay"", and pledged to fund ""care-based alternatives"" and shift the approach from ""one of punishment to one of love and support"".The announcement came after Scotland\'s chief inspector of prisons, Wendy Sinclair-Gieben, said sending 16 and 17-year-olds to Polmont - especially those who had not yet been convicted - was a breach of their human rights.The Children (Care and Justice) (Scotland) Bill - which sets out that children under the age of 18 will no longer be sent to prison - received Royal Assent last month and became an act of parliament.Separate legislation passed by Holyrood to incorporate the United Nations Convention on the Rights of the Child (UNCRC) came into force on Tuesday.As of 12 July, there were nine 16 to 17-year-olds held in custody at Polmont. Six were untried, two had been sentenced and one had been awaiting sentencing.', 'Wendy Sinclair-Gieben told BBC Scotland News, the “intent” to remove children from prisons in Scotland was there, but the speed at which it was being achieved was “not great”.She told BBC News: ""There should be no more children in prison. I don’t think Polmont is a good place for children.”Minister for Victims and Community Safety Siobhian Brown, said every death in custody was a tragedy and that the government was working to end the placement of under-18s in young offenders institutions.She said: ""We are working with the Scottish Prison Service and secure accommodation providers to commence these provisions shortly. The decision on whether to detain a child remains with the independent judiciary.”', ""A joint fatal accident inquiry (FAI) was held earlier this year into the deaths of Katie Allan, 21, and William Brown, 16, who both took their own lives at Polmont within months of each other in 2018. Katie, a geography student at Glasgow University, was jailed for16 months for drink-driving after hitting a 15-year-old boy, who was knocked unconscious.William, also known as William Lindsay, who had never been convicted of a crime, had only been sent to Polmont because a place could not be found for him in a secure children's unit.A separate FAI was also recently held into the death of Jack McKenzie, who took his own life at Polmont on 3 September 2021.He had been on remand at Polmont for rape and sexual assault charges - which he denied - since January of that year."", 'Katie Allan’s mother, Linda Allan told BBC Scotland she is “devastated” for Jonathan Beadle\'s family but she is not surprised to hear about the latest death in Polmont.""The only thing that surprises me is that not more young people are dying,"" she said.Ms Allan has previously criticised the ""inadequacies of the prison suicide strategy, which apparently ignores evidence"" and ""the flawed system of relying on prisoners self-reporting suicide ideation"".Sheriff Simon Collins, who heard both inquiries, is expected to make recommendations for change when he delivers his determination into the circumstances of all three deaths later in the year.The purpose of an FAI is to establish whether the deaths could have been prevented.It will also examine what precautions could be taken in future to try and stop young people from taking their own lives in prison.']"
Gething rival Miles likely to run to lead Wales,https://www.bbc.com/news/articles/cevw4znzz4ko#1,"Jeremy Miles, narrowly beaten in the last Welsh Labour leadership contest, is likely to stand again.","Wed, 17 Jul 2024 15:34:59 GMT",2024-07-17 16:47:11.884277,"[""Vaughan Gething's former rival Jeremy Miles is likely to run in the upcoming Welsh Labour leadership contest, BBC Wales understands.A source close to Mr Miles, who was one of the four people who resigned from the Welsh government and forced Mr Gething to quit, said others have encouraged him to stand.Two supporters of Mr Gething say the former economy secretary cannot unite the group and cannot be the next first minister.Mr Gething announced he would stand down after three ministers and the Welsh government's legal adviser dramatically released resignation statements calling for him to go."", 'Late on Wednesday the Welsh government announced how it would fill the vacant roles, mostly by expanding the portfolios of existing ministers.Jack Sargeant joins the government for the first time as a junior member of the government, while Jayne Bryant has been promoted to Local Government Secretary.One of the other men named as a potential successor to Mr Gething, Huw Irranca-Davies, failed to rule himself out of the running.It is believed that Transport Secretary Ken Skates is considering putting his hat in the ring, but former counsel general Mick Antoniw - one of the four people who resigned - has ruled himself out. Opposition parties have called for the first minister to fill the roles vacated.Meanwhile Wales\' previous first minister Mark Drakeford has said that Mr Gething was ""haunted"" by decisions he took which he has never been able to shake off.Mark Drakeford said the outgoing Welsh Labour leader was ""dogged"" by decisions taken over campaign donations and the sacking of a minister.Another former holder of Wales\' top job, Alun Michael, said Mr Gething had been ""forced out"".', 'Mr Miles came second in the leadership contest in March with 48.3% of the vote, versus Mr Gething\'s 51.7%.Since the result he moved from the job of education minister to economy secretary under the new first minister.He had declined to give a view on the £200,000 donation from a controversial waste company, whose owner had been previously convicted of environmental offences, during the campaign itself - but a month later said he would not have accepted the money.On Monday, a day before his resignation, he repeatedly failed to support Mr Gething in an interview.In his letter to the first minister outlining why he was quitting, Mr Miles said: ""The events of the last few months including you loss of the confidence vote in the Senedd have been incredibly painful.""This has become a distraction from the important work of the Welsh government and is damaging our party"".Dates for the contest are yet to be set, although Mr Gething has said his replacement would be installed by the autumn.', 'But two supporters of the first minister have told BBC Wales that Mr Miles\' involvement in forcing Mr Gething\'s exit makes him unsuitable to take over.One Gething supporter suggested they would rather ""die in a ditch"" than have Mr Miles as leader of the party.They said they would like to see Eluned Morgan run, saying she was a communicator who could connect the party with traditional backers of Labour.Another supporter said Mr Miles could not unite the party and there was ""a very strong feeling that the person who is associated with a bloodied knife cannot claim the crown"".They added: ""I\'m really worried about what this says to the world, to people in the United Kingdom and especially in Wales who are not white.""It looks like a bunch of people have drawn daggers and knifed Vaughan without giving him a chance. I do find that really difficult to deal with.""In a response, a backer of Mr Miles said: “The people who did their best to block Jeremy last time are up to their old tricks, it seems. Let the members decide.""Mr Miles had more nominations from Labour Senedd members than Mr Gething last year, with 16 versus Mr Gething\'s ten.', 'A separate Miles supporter said it was not ""credible"" for Mr Gething to carry on through the summer as he no longer had the support of ""the group, cabinet or Senedd"". ""That can’t be shrugged off and major decisions continued under a set of caretaker ministers as if the political geography hasn’t altered.""', 'By Cemlyn Davies, political correspondentAfter coming so close four months ago, it is not surprising that Jeremy Miles is said to be “likely” to run again to be Welsh Labour leader.But he’ll know that some staunch Vaughan Gething allies in the Senedd Labour group, who feel Mr Miles has played his part in their man’s downfall, are very much opposed to him becoming leader.However, as long as enough Labour MSs back him (and most of them did last time around), his opponents won’t be able to prevent him getting on the ballot paper.It would then be down to the membership to decide if he should lead the party.In the meantime, I’m hearing differing accounts about the sequence of events that ultimately led to Mr Gething’s decision to step down.Sources have told me that three of the cabinet members who resigned on Tuesday morning – including Mr Miles – tried to meet Mr Gething beforehand in the hope their resignations could still be avoided, but he wouldn’t see them.However, an aide to the first minister has said there was no such request for a meeting.', 'Speaking on BBC Radio Wales Breakfast, Mark Drakeford said there were ""decisions"" made by Mr Gething ""that have haunted him"". ""They’ve lived with him over the weeks and months that go by and he\'s never been able to shake those original decisions off.“In the end, I think he came to the very difficult decision but the correct decision, that he was never going to get to a point where he would be able to focus on the things he wanted to in the way he wanted to do them, without these stories always being the filter through which news of his first ministership was going to be reported.""', 'Mr Drakeford said there had to be a contest for the leadership and he was ""opposed to a coronation"".He added: ""I think it can be a cathartic experience for the Labour Party, and I think that members of the public will benefit from being able to see the candidates who could be Labour\'s nominee for leader.""There has been talk of whether there could be an interim first minister over the Summer but Mr Drakeford said Mr Gething should be allowed to stay in post to avoid ""another change"".When asked, he said he ""absolutely would not"" like the interim job.Mr Irranca-Davies has not ruled out throwing his hat into the ring, but said it was ""too early to speculate"".', 'Without naming individuals, political consultant Cathy Owens said it would be difficult for someone ""involved with some of the shenanigans"" and some of the ""acrimony"" to be Welsh Labour leader.Ms Owens, who advised the late first minister Rhodri Morgan, said Labour needed a Marks & Spencer candidate, as ""it\'s not anybody’s favourite shop"" but nobody hates it.She said the next leader is going to have to ""unite their party whilst also negotiating with the opposition"".', 'Mr Michael, who led the Labour administration in the Welsh assembly from 1999 to 2000, told BBC Radio 4\'s The World Tonight: ""A lot of people are very angry and frustrated about the fact that Vaughan has been in effect forced out.""', 'Andrew RT Davies, leader of the Welsh Conservatives in the Senedd, said an interim cabinet needed to be appointed as people ""rightly want to know how those ministers’ portfolio responsibilities will be carried out while a new first minister is selected"".Plaid Cymru claimed Labour was now ""rudderless"" and repeated calls for a Senedd election.Plaid\'s Llyr Gruffydd said: “Today is the last day of the parliamentary term before summer recess. The first minister must come to the Senedd and set out his plans to ensure a functioning government at the very least.', ""In Wednesday's cabinet reshuffle, Jack Sargeant joined the government for the first time as minister for social partnership.Ken Skates, who is already transport secretary, will take on Jeremy Miles' former portfolio as economy secretary as an additional responsibility.Jayne Bryant, the Newport West MS, will be promoted to be cabinet secretary for local government and housing.Sarah Murphy will move to be minister for mental health and early years.Jane Hutt's job will expand to cover Lesley Griffiths' former role. As well as chief whip, she will be cabinet secretary for culture and social justice.Mick Antoniw's job as counsel general has not been replaced as of yet.Mr Gething will retain oversight on discussions with Tata Steel, he said."", 'On Tuesday, Mr Gething announced he was resigning as first minister and that a new leader would be in place in the autumn.It came after four cabinet members all quit their positions simultaneously and demanded he follow suit.He will carry on leading the Welsh government until his successor is chosen.Mr Gething has been dogged by questions over the £200,000 campaign donation from Dauson Environmental Group.He has also been criticised over the sacking of former minister Hannah Blythyn for allegedly leaking to the media, which she denies.In his resignation speech, Mr Gething denied any wrongdoing, saying: ""I regret that the burden of proof is no longer an important commodity in the language of our politics.""In 11 years as a minister, I have never ever made a decision for personal gain.""I have never ever misused or abused my ministerial responsibilities.""', 'Mr Michael, who resigned from Labour\'s top job in Wales in 2000, said he was a friend of Mr Gething’s and had spoken to him on Tuesday.""He’s very sad and he’s very regretful that he hasn’t been provided with the support that he needed,"" he said.Mr Michael said there were ""good people in the Senedd"" who could be leadership contenders, including Ms Morgan and Mr Irranca-Davies.The ruling body of Welsh Labour will meet at the weekend and is expected to set out a timetable for the leadership campaign.']"
Coroner 'feared for my family' in kidnap plot,https://www.bbc.com/news/articles/cjjw9w4v0j7o#1,Lincoln Brookes becomes tearful in court as he details the effect an alleged plot had on him.,"Wed, 17 Jul 2024 14:22:36 GMT",2024-07-17 16:47:11.884664,"['A coroner became tearful in court as he explained how an alleged kidnap plot made him ""fearful for the safety of my family"".Lincoln Brookes said upon hearing a group had stormed Essex Coroner\'s Court in Chelmsford while he was on his way there, he ""started driving home as fast as I could"".It followed a series of letters sent by an ""anti-establishment group"" that contained ""human matter"" including blood, a trial heard.Mark Christopher, 58, Matthew Martin, 47, Shiza Harper, 45, and Sean Harper, 38 - from Essex and east London - deny plotting to abduct Mr Brookes.', 'The defendants are accused of using ""self-conferred"" legal powers in an attempt to ""close down the courts"" in Essex.', 'The trial has been shown a video of the group wearing hi-vis jackets and carrying handcuffs as they entered courtroom two at Seax House in Chelmsford.Allister Walker, prosecuting, said it was only ""by chance"" that Mr Brookes was not present when the kidnap plot was carried out.', 'Giving evidence at Chelmsford Crown Court, Mr Brookes said he was alerted to the break-in by his colleague, area coroner Michelle Brown.""She warned me that... these are the people who are in that letter and they are coming to get you,"" he told the jury.""Because of what she said I turned around and started driving home as fast as I could because I was fearful for the safety of my family.""Becoming tearful in the witness box, Mr Brookes added: ""I pulled over, in fact, because I was a bit upset"".Ms Brown said the group, upon entering her courtroom, accused her of ""interfering with the dead"".""I was very afraid. They clearly were not bothered by any authority,"" she told the jury.""I said: \'You can have the court, take the court but please don’t hurt me, don’t hurt us – let us go\'."" ', 'Mr Brookes, the senior coroner for Essex, said he received a series of letters between March 2022 and April 2023 that were ""very bizarre"".One of the 25-page letters was covered in fingerprints and photocopies of ""human matter"" including DNA, saliva, hair and blood, Mr Walker said.Mr Brookes said the writing within the letters was ""gobbledegook, gibberish"".""The grammar and syntax of it was written in a way that did not represent normal English,"" he told the jury.They included alleged accusations of Mr Brookes being a ""detrimental necromancer"" who was ""under the penalty of perjury"".""I thought this was odd, to say the least,"" Mr Brookes added.', 'Further correspondence demanded that Mr Brookes should pay £1.3m to Mr and Mrs Harper or ""be sentenced to seven years behind bars"".Mr Brookes said he was ""troubled"" by the ""upsetting"" nature of the letters and believed them to be ""a serious threat"".Sean and Shiza Harper, from South Benfleet in Essex, and the other defendants all deny conspiracy to kidnap and conspiracy to commit false imprisonment.Mr Martin, from Plaistow, east London, also denies assault by beating and criminal damage.Mr Christopher, from Forest Gate, east London, has pleaded not guilty to a further charge of sending a letter or email with intent to cause distress of anxiety.The trial continues.', 'Follow Essex news on Facebook, Instagram and X. Got a story? Email eastofenglandnews@bbc.co.uk or WhatsApp us on 0800 169 1830']"
Stormzy and Maya Jama announce split,https://www.bbc.com/news/articles/c1dm3mynz4go#1,"The rapper and Love Island presenter say they have ""decided to call it quits"" but ""are still friends"".","Wed, 17 Jul 2024 10:43:26 GMT",2024-07-17 16:47:11.885002,"['Stormzy and Maya Jama have announced they have split up.The rapper and Love Island presenter shared a joint statement on Instagram, saying they had been trying to make their relationship work since they got back together last year. ""We tried, and it didn\'t work, and that\'s okay,"" they said.The post started: ""We\'ve been laughing whilst drafting this because we never, ever, in a million years thought we\'d be the couple announcing a breakup.""But for the sake of clarity and, more importantly, to allow us the space and grace that\'s needed for us both to be able to navigate this next bit of our lives with peace, we thought it might be best to.""The pair said they fell ""madly in love in 2014"" before breaking up five years later.""We decided to try for the final time in August 2023, and we\'ve spent this past year trying our best to make it work; however, we recently decided to call it quits,"" they said.""We were 21 and 20 when we first met - both at the beginning of our careers - and spent five years growing together and then five years growing separately, so this final attempt required a whole lot of figuring out, relearning, and unlearning.""The pair added that they would remain friends, and asked for people ""not to cause a fuss"" if they see them catching up if they cross paths in the future at events like the Brit Awards.""We still think the absolute world of each other, we still care and respect each other, we are still grateful for the time we\'ve had together, and we are still friends and will always be friends.""The post ended: ""We\'re kindly asking for the grace to let both of us keep it moving and not be bothered about it (we highly doubt this\'ll work, but we\'re still kindly asking anyway).""Love you guys and thank you for all the love you\'ve showered us with, it\'s been beautiful.""']"
DIY kits may see million more cervical-cancer tests,https://www.bbc.com/news/articles/cjk3z57nd1do#1,"One million more women would have life-saving checks if the NHS adopted self-testing, researchers estimate.","Wed, 17 Jul 2024 00:44:48 GMT",2024-07-17 16:47:11.885166,"['More than one million extra women could have life-saving cervical-cancer checks if the NHS adopted do-it-yourself testing, researchers estimate.The team at King’s College London said the results of its self-testing trial were “fantastic” and “gave power to women”.The kits are like a Covid swab but longer and are posted to a lab for analysis.The NHS called the findings extremely positive and is assessing whether to roll out the scheme.', 'There are more than 3,000 new cases of cervical cancer in the UK each year. The cervix is the small opening joining the top of the vagina to the base of the womb.', 'Women are invited for cervical-cancer screening – what used to be known as the smear test – every three to five years between the ages of 25 and 65.But about 4.6 million women in England – nearly a third of those offered screening – do not come forward.“Cervical cancer screening has been in decline for the last 20 years,” a senior consultant on the trial, Mairead Lyons, said.""Many women will describe it as an uncomfortable experience [or they are] too busy, embarrassed or afraid of the physical experience of it.""The YouScreen trial is the first time self-testing has been offered as part of cervical-cancer screening in the UK.Women, and people with a cervix, were offered a self-testing kit in one of two ways:If they were six months overdue for screening and went to their GP for any reason, their doctor would be automatically alerted and offer a kitIf they were 15 months overdue for screening, a kit was sent to their home address', 'The kit contains a long cotton-wool bud, used to swab the lining of the vagina for about 20 seconds.This is sent to a laboratory to test for human papillomavirus (HPV) which causes most cervical cancers.If this is positive, they are invited for a further test to see if any cells in the cervix have started the journey to becoming a cancer.The trial ran in five London boroughs, in 2021, and 27,000 test kits were offered.The results, published in eClinicalMedicine, showed:56% completed tests offered by their GP 13% completed tests posted to their homeIf these results were replicated across the whole of England, the researchers estimate it would increase the proportion screened from 69.9% to 77.3% - about one million extra women over a three-year screening cycle.The trial also showed self-testing reached women irrespective of their ethnicity or wealth.', '“I am so excited by it,"" Ms Lyons told me.""I’ve spent over 30 years in the health service and this is fantastic.""Dr Anita Lim, from King’s College London, said: “Self-sampling has been hailed as a game-changer for cervical screening - and we now have evidence in a UK population to show that it really is.” Self-testing is already offered in Australia, the Netherlands, Denmark and Sweden.NHS England screening and vaccination director Deborah Tomalin called the trial results “extremely promising”.“The NHS will now be working with the UK National Screening Committee to consider the feasibility of rolling this out more widely across England,” she said.', 'Meanwhile, the HPV vaccine is cutting cervical cancer by nearly 90%.And Prof Peter Sasieni, who was also involved in the self-testing trial, said young women who had had the HPV vaccine in childhood may need only one to three cervical cancer screenings in their lifetime. No changes to the screening programme for vaccinated women have yet been made so the advice is to attend when invited for screening.But he added: ""Unfortunately, women born before 1990 are unlikely to benefit from the HPV vaccine, so regular screening is vitally important to protect those who have not been vaccinated.""', ""vaginal bleeding that's unusual for you – including during or after sex, between periods or after the menopause - or heavier periods than usual changes to vaginal dischargepain during sex or in the lower back, lower tummy or between the hip bones (pelvis)Source: NHS""]"
