title,url,description,date,time_crawl,text
"Girl, 9, shot by motorcyclist may never 'speak or move properly again'",https://www.bbc.com/news/articles/cx0243yv17xo#0,Police release a CCTV image of a motorbike rider they are trying to trace over the shooting in May.,"Wed, 17 Jul 2024 07:30:07 GMT",2024-07-17 16:47:11.883345,"['A nine-year-old girl injured when a motorcyclist fired a number of shots towards a restaurant in east London seven weeks ago remains ""stable"" but may not ""speak or move properly again"", her parents have said.The shooting occurred on Kingsland High Street, Dalston, at about 21:20 BST on 29 May. Three men, aged 26, 37 and 42, who were sitting outside the restaurant were also injured. They have all been sent home from hospital.The Metropolitan Police has released CCTV images of the motorcyclist they are trying to trace over the shooting.', 'The girl\'s parents say they are ""devastated about what has happened"".""She only went there for ice cream and now we do not know if we will ever get our daughter back to being the smart, funny girl that she was before and whether she will be able to ever speak or move properly again.""', 'Det Ch Supt James Conway said detectives believed the shooting could be linked to ""Turkish-originating organised criminal networks"".Detectives had previously appealed to east London\'s Turkish and Kurdish communities for information on the shooting.“Our investigation team has been working tirelessly to piece together what happened and to identify the dangerous individuals responsible for this shocking and indiscriminate act of violence,"" Det Ch Insp Conway continued.', 'He said the motorcycle had been in the Peckham and Crystal Palace areas and urged anyone with information about it or the rider to contact police. Last month, the police identified the bike as a Ducati Monster motorbike that was dumped close to the shooting on Colvestone Crescent.', 'In 2021 the bike - described as having a white body, red chassis, red wheels and a registration plate of DP21 OXY - was stolen from a property in Wembley, north London, the Met said.""The nine-year-old girl who was injured was simply out having dinner with her family. She remains in hospital in a critical but stable condition,"" Det Ch Insp Conway added.""Whoever this person is, they are dangerous and must be removed from our streets.""The girl\'s parents added: ""We need our child back and we are all praying for her full recovery.""', 'Listen to the best of BBC Radio London on Sounds and follow BBC London on Facebook, X and Instagram. Send your story ideas to hello.bbclondon@bbc.co.uk']"
Health alert as temperatures to hit 30C this week,https://www.bbc.com/news/articles/c4ngkgw381ro#0,But the warm temperatures will give way to cooler and wetter weather later this week.,"Wed, 17 Jul 2024 13:09:13 GMT",2024-07-17 16:47:11.883456,"['A heat-health alert has been issued for parts of England, with temperatures predicted to hit 30C (86F) on Friday.The alert is in place from 17:00 BST on 18 July in London, the East Midlands, South East and eastern England.Areas across the UK that have experienced a July washout so far are now set to turn a lot drier and warmer, albeit briefly.The weekend will see a band of rain move across the UK from the west, bringing in showers and some thunderstorms, and cooler weather for all by Sunday.', 'This will be the first spell of warm weather for most of the UK this month, but it is unlikely to mark the start of a heatwave.For a heatwave to be declared, temperatures must be above the official heatwave threshold for at least three consecutive days.In the London area, that threshold is 28C. For Scotland, Northern Ireland, Wales and most of northern and western England, it’s 25C.But temperatures could set a new record for the hottest day of the year, after 30.5C was recorded in Wisley, Surrey on June 26.', 'A yellow warning indicates that weather conditions could pose a risk to those who are particularly vulnerable.The UK Health Security Agency (UKHSA) has issued yellow heat-health alerts from 17:00 BST on 18 July for four areas of England:East MidlandsEastLondonSouth EastThe alerts will remain in place until 23:00 on 20 July.', 'July has been wet and chilly across much of the UK, with temperatures falling below or just at the seasonal average. Some parts of the country, including Loftus in North Yorkshire and Northolt in London, have already had more than twice the average rainfall for July.It has not been a washout everywhere though. Some northern and western areas, including Castlederg in Northern Ireland and Machrihanish in western Scotland, have been comparatively dry and seen only about 20 to 25% of their average July rainfall.Northern Ireland is a lot drier compared to last July, which was its wettest on record.The cool and wet July across much of the country has been a result of the jet stream – fast-moving wind high in the atmosphere – being positioned predominantly over or to the south of the UK.In the next few days, the jet stream will shift to the north - allowing a plume of hot air from northern Africa and Spain to bring in a few days of sunshine for some parts of the UK.Over the weekend, however, a thundery breakdown in the east will lead to temperatures dipping back to average, and cooler weather for all of the UK by Sunday.Expect some showers and longer spells of rain next week, especially in the north and west.']"
Man who killed girlfriend in crash jailed for 10 years,https://www.bbc.com/news/articles/ck5g97rrl1lo#1,Cameron Jones drove into a garden wall and left 25-year-old Demi Mabbitt lying injured in the road.,"Wed, 17 Jul 2024 15:44:34 GMT",2024-07-17 16:47:11.883568,"['A disqualified driver who killed his girlfriend after speeding into a garden wall has been sentenced to 10 years in jail.Cameron Jones, 30, was behind the wheel of the white Audi S3 when it crashed, before abandoning 25-year-old Demi Mabbitt who was lying seriously injured in the road on 5 April.Jones ran away from the scene on Merthyr Tydfil\'s Swansea Road, prompting a police manhunt, before he turned himself in three weeks later.A judge said his actions were ""inhuman and self centred"" and showed cowardice.', 'Jones, from Merthyr Tydfil, pleaded guilty to causing death by dangerous driving and also admitted he was uninsured and disqualified, failed to stop after the crash or report it, making a total of five charges.Abigail Jackson, prosecuting, told the hearing at Merthyr Tydfil Crown Court on Wednesday that one eyewitness estimated Jones reached speeds of up to 120mph on the 20mph road.While CCTV footage showed he was speeding, the precise speed could not be pinpointed, she added.', 'Chad Pop, who was driving behind Cameron Jones, said the road was ""soaking wet"" and while the Audi was ""initially driven normally"" it later accelerated ""dramatically"".Mr Pop described the crash ""like a bomb had gone off"" with ""car parts everywhere"".The court heard Jones approached Chad Pop and asked for a lift, but was refused.Another eyewitness, who saw the aftermath of the crash, recalled Jones saying: ""I need to get the guy who was driving the car.""But he told another eyewitness: ""My missus has just crashed her car.""Ms Jackson told the court there was damage to nearby properties and pieces of the Audi were found strewn over the road.', 'There was also significant damage to the car. The tyres had ""exceptionally low grip"" and the front-side windows were heavily tinted, both well below the legal limit, she said.Ms Jackson said Jones had 27 previous convictions for 55 offences, including motoring convictions.Jones was released from custody on 6 March 2024, 30 days before the crash, and was subject to licence conditions at the time.Andrew Davies, defending Jones, said his client understood the ""incurable hurt and pain of his actions"" and was ""devastated by the consequences of his driving"".', 'Sentencing Jones to 10 years in prison, Judge Jeremy Jenkins said his actions were ""deliberate and dangerous"" and ""inhuman and self centred"".""With self preservation in mind, you took a bag from the vehicle and with no regard for Ms Mabbitt, you ran away,"" he said.""You have shown not the slightest remorse or contrition.""Jones was also disqualified from driving for 10 years.One CCTV clip played in court showed Jones ""walk over to where Ms Mabbitt is, appear to lean over and check her, before walking away"", said Ms Jackson.The court heard how a member of the public saw Ms Mabbitt lying on the side of the road, 27m (89ft) from the car, with ""serious"" injuries, and performed CPR.She was taken to the University Hospital of Wales in Cardiff where she was assessed as having an ""extensive head injury"".By 11 April her condition deteriorated and she died at 11:20 BST the following day.', 'Paying tribute to his daughter in court, Paul Mabbitt said his family was ""torn apart"" by the loss.He said his daughter ""had the most amazing laugh and put a smile on everyone’s face"".""I will never be able to forget what I saw that day and the image of Demi lying on the side of the road.""He said Ms Mabbitt had been in a relationship with Jones for four years and the family ""did not approve"" of him.Her sister, Gemma Williams, said Ms Mabbitt ""trusted too much and fell for the wrong person"".""She was the best sister with a heart of gold,"" she said.', 'After the sentencing, Jordan Jones of the Crown Prosecution Service said: ""This case highlights the severe consequences of dangerous driving.""Cameron Jones’ actions have led to a tragic loss of life, and his attempts to evade responsibility only compounded the grief of Demi Mabbitt’s loved ones.”Det Sgt Debbie Hobrough, a serious collision investigation officer, added: “Demi Mabbitt lay dying on the side of the road when Jones callously fled from the scene of the crash without trying to help her.""The tragic manner of Demi’s death has shaken the whole community.""Demi\'s father, Paul Mabbitt, thanked the police and said it had been a difficult day for the family, adding: ""No sentence will ever be enough to bring justice for the death of our beautiful girl Demi.""Our family is broken. We love you Dems, forever and always.""']"
'Adored' Royal Navy D-Day veteran dies aged 98,https://www.bbc.com/news/articles/cn4v2yn20j8o#1,"George Winter, from Arborfield, in Berkshire, volunteered for the Royal Navy as a 17-year-old in 1943.","Wed, 17 Jul 2024 15:23:11 GMT",2024-07-17 16:47:11.883687,"['One of the last surviving British servicemen to take part in the D-Day landings has died at the age of 98.George Winter, from Arborfield, in Berkshire, served in the Royal Navy between 1943 and 1947 - having initially volunteered as a 17-year-old.He was one of about 150,000 allied troops who took part in the Normandy Landings on 6 June 1944 - serving as a quartermaster on a minesweeper.George\'s grandson Tony Winter told the BBC that his grandfather was a ""really funny guy"" who ""loved telling stories"".', 'In an interview with BBC Radio Berkshire just over a month before his death, Mr Winter described his early life, and his time serving in the Royal Navy.Having volunteered at 17, he said his ""dear old mum was very worried"", adding that she ""wasn\'t very happy"" about him volunteering - but that he felt he had to ""do something"".During his four years in the navy, Mr Winter visited Scotland, Iceland and Russia whilst serving on minesweepers HMS Harrier and HMS Combatant, as well as on battle class destroyer HMS Aisne.', 'But it was the D-Day landings that Mr Winter remembered the most vividly.""On D-Day we led the way - the minesweepers were the first there.""We just swept it all clear so the big ships could come in without hitting any mines - we were right of the French coast - that\'s where the Jerries [German troops] were firing at us.""Mr Winter\'s ship came under artillery and sniper fire, and sailed within view of the fighting on Juno, Sword, and Gold beaches.""Lots of lads went in the water, which was a shame - I jumped in the water to get the boys out.""Couldn\'t have them drowning could we?""He said he remembered being ""frightened"" but added: ""It made a man out of me.""', 'Tony Winter said his grandfather ""really cared for people and wanted to look after people"".""He was very strong on the belief of the family and keeping people together and everybody pulling in the same direction - family was a massive thing for him.""', 'He said his grandfather was ""always very proud"" of being part of D-Day, adding ""that is always going to be remembered"".""With everything that he did and everything he achieved and all his medals, I think his proudest achievement was being a father, grandfather and great grandfather,"" he added.', 'George Brown, chairman of the Royal British Legion\'s Arborfield branch, said: “George was absolutely fantastic - we all loved and adored him.""He gave everything for us, so we could be here, he went to war for us - I wouldn’t be here, my children wouldn’t be here""We owe this guy everything, our way of life, our culture."" ""There’s nothing I can say that can ever express the love, and the gratitude, that we owe him, because what he gave us is just huge - it’s immense,” Mr Brown added.', 'When asked what his message to younger people would be after all he had learnt from the conflict he had seen, veteran George Winter simply said: ""Just be friendly to people and don\'t make anymore wars.""', 'Follow BBC South on Facebook, X (Twitter), or Instagram. Send your story ideas to south.newsonline@bbc.co.uk or via WhatsApp on 0808 100 2240.']"
Amazon workers narrowly reject union in historic vote,https://www.bbc.com/news/articles/c8vd72zrpr1o#1,If the GMB had won it would have been the first time Amazon recognised a union in the UK. ,"Wed, 17 Jul 2024 11:05:05 GMT",2024-07-17 16:47:11.883800,"['The GMB has narrowly lost its historic bid for union recognition at the Amazon warehouse in Coventry. Some 49.5% of workers balloted voted in favour, while 50.5% voted against. The union needed a majority to vote in favour.If the GMB had won it would have been the first time Amazon recognised a union in the UK. The online giant would have been forced to negotiate with workers on issues such as pay and conditions.In a statement, Amazon said it placed ""enormous value on engaging directly"" with staff.""We look forward to continuing on that path with our team in Coventry,"" it added.The GMB told the BBC it is considering trying again to get recognition at the Coventry site and that discussions are taking place about its strategy. The process would include persuading the Central Arbitration Committee, which is in charge of overseeing applications for recognition, that the pool of workers eligible to vote had changed.', 'The GMB, which lost by 28 votes, said its drive for recognition fell “agonisingly short” and accused Amazon of “union-busting”.It said there were “anti-union messages by company bosses, including multiple anti-union seminars” at the warehouse.It added that “the fire lit by workers in Coventry and across the UK is still burning”, and that the union would “carry on the fight”  for low paid workers.', ""The union's fight for recognition had been described as a David vs Goliath battle, with workers facing fierce resistance from the online giant.It began with a rag tag show of defiance in the summer of 2022, after Amazon offered workers a pay rise of between 35p and 50p an hour. Having toiled in warehouses during the Covid pandemic, workers said this felt like an insult, and in Coventry a small group of angry workers spontaneously walked out and protested outside the fulfilment centre. Then the GMB got involved and urged the workforce to unionise.In January 2023, with a GMB membership of just 50, Coventry workers held the first ever Amazon strike in the UK. "", 'It went on to organise a further 37 days of industrial action over the last year and by recruiting on the picket line, steadily built up its membership to more than 1,400 members out of the centre\'s estimated 3,000 plus workers.In April the union launched a legal challenge against Amazon, claiming it used underhand tactics to encourage members to cancel their union membership.On Wednesday it said that legal challenge would continue. As part of the challenge, the GMB says Amazon put up posters in fulfilment centres featuring QR codes that generated an email to the union’s membership department requesting that their membership be cancelled.Amazon responded saying that “employees were telling us they wanted to cancel their membership but could not find a way to do so, so we provided information to help. ""We have always been clear, that union membership is an employee’s personal choice.”', 'Amazon, which is one of the UK\'s largest private sector employers, with 75,000 workers, made it clear all along that it did not want to recognise a union and that it wanted to retain direct communication with its staff. After the vote on Wednesday, it further reiterated that “having daily conversations” with staff was “an essential part of our work culture”.“We value that direct relationship and so do our employees. This is why we’ve always worked hard to listen to them, act on their feedback, and invest heavily in great pay, benefits and skills development,"" the firm added.The GMB says it is surprised by what it sees as the fearlessness of an overwhelmingly immigrant workforce, many of whom arrived recently from South Asia. Union organisers estimate that as little as 5% of the Coventry employees are British born and its campaign leaflets were translated into 12 different languages. They say that in the beginning many were frightened to get involved but as the strikes wore on, and people saw that workers who’d joined picket lines weren’t facing disciplinary action, their confidence grew.The union is hopeful that the government will strengthen their power to organise. Labour has promised legislation in today\'s King\'s Speech to make it easier for unions to win recognition ballots by lowering the required threshold for victory and to make it easier for union officials to recruit in workplaces.', 'The general secretary of the Trades Union Congress, Paul Nowak, said that despite taking on one of the ""world\'s largest corporate giants"", the Coventry union members ""only narrowly missed out"" on securing recognition.""With Labour set to usher in a new era of stronger workers’ rights, companies like Amazon are on the wrong side of history,"" he added.But Gregor Gall, a professor of industrial relations at Glasgow university, questioned whether GMB had the resources to take the fight to other Amazon centres.""The cost of union organising is very high. The GMB had officers working full time on it. We won\'t necessarily see organising drives elsewhere,"" he said.Professor Gall\'s caution is understandable considering what has happened in the United States. In 2022 Amazon workers at its Staten Island warehouse in New York became the first in the US to win union recognition. Two years on, the company has still not sat down to negotiate with the union and continues to fight legal challenges to the vote.']"
Man appears in court after men's remains found in suitcases,https://www.bbc.com/news/articles/c6p29ye79mdo#1,Yostin Mosquera appears at the Old Bailey charged with murdering Paul Longworth and Albert Alfonso.,"Wed, 17 Jul 2024 11:38:13 GMT",2024-07-17 16:47:11.883912,"[""A man has appeared at the Old Bailey charged with murdering two men whose remains were found in suitcases at Bristol's Clifton Suspension Bridge and at a London flat.Yostin Andres Mosquera, of Scotts Road, Shepherd’s Bush, west London, is accused of murdering Albert Alfonso, 62, and Paul Longworth, 71, between 8 and 10 July in the London borough of Hammersmith and Fulham.The defendant, a Colombian national, appeared via video link and was remanded into custody. He listened intently as his Spanish interpreter relayed proceedings.Mr Mosquera is set to next appear at the same court for a plea hearing on 2 October."", 'Prosecutor Teresa Hay, also appearing in court by video link, formally accused Mr Mosquera of killing the two men.She told the court she was not aware of any links the defendant had to the UK other than through the deceased.Mr Longworth was British and Mr Alfonso was originally from France with British citizenship.', 'Ms Hay told the court Avon and Somerset police had been called to the Clifton Suspension Bridge in Bristol shortly before midnight on 10 July, where officers had discovered human remains in suitcases that were linked to an address in Shepherd’s Bush, west London.Police entered the London address, in Scotts Road, where they found more remains, the prosecutor said.Following a high-profile search, the defendant was arrested on Saturday at 02:15 BST at Bristol Temple Meads train station.Mr Mosquera’s defence barrister, Edward Hetherington, also appearing via video link, did not make an application for bail.', 'Listen to the best of BBC Radio London on Sounds and follow BBC London on Facebook, X and Instagram. Send your story ideas to hello.bbclondon@bbc.co.uk']"
"Lollipop man, 86, plans 'mad week in Benidorm' after retiring",https://www.bbc.com/news/articles/c729xweplrxo#1,"Arthur Parker, 86, says he has ""enjoyed every minute"" of his 22 years as a lollipop man.","Wed, 17 Jul 2024 14:36:11 GMT",2024-07-17 16:47:11.884027,"['A much-loved lollipop man who is retiring after more than two decades says he is planning a ""mad week in Benidorm"" to celebrate the milestone.Arthur Parker, 86, has helped pupils at Leyland Methodist Junior School in Lancashire cross the road safely for 22 years.He is known for his high fives and infectious smile and said the joy he got out of the job is what had kept him young. Mr Parker said he had ""enjoyed every minute"" of his morning and afternoon job.', 'Speaking about his decision to hang up his lollipop, he said: ""It\'s a busy road and I think I\'m getting on a bit over the hill now.""Mr Parker, who is originally from Workington, Cumbria, told BBC Radio Lancashire: ""I\'ve enjoyed every minute of it. It keeps me active.""He said: ""If I can send them [the pupils] into school with a nice smile on their face, I think I\'ve done a good job.""Mr Parker said he was originally a caretaker at the school but when the last lollipop person left, he took over.He said former pupils who he used to assist in crossing the road were now grown up, and bringing their own children to the school.One parent said: ""[Mr Parker] is the first person they see and he gears them up for the day.""There\'s going to be a lot of sad faces when he goes,"" she said.', 'Lily, a Leyland Methodist pupil, said: ""I think he is really funny and kind and he makes me laugh.""Another pupil, Chloe, said: ""He\'s a really lovely guy and he always gives high fives and makes kids smile when they cross the road.""Mr Parker said he was feeling emotional. ""It is going to be a sad day on Friday when it all ends. This school is absolutely brilliant.""He added: ""I\'ve had some really happy times here.""He said he was ""going for a mad week in Benidorm"" and plans to visit relatives in his native Workington in his retirement.', 'Listen to the best of BBC Radio Lancashire on Sounds\xa0and follow BBC Lancashire on Facebook, X and Instagram. You can also send story ideas to northwest.newsonline@bbc.co.uk']"
