title,url,description,date,time_crawl,text
Indian man stuck in lift for 42 hours thought he would die,https://www.bbc.com/news/articles/c4ngwv59wq4o#1,Ravindran Nair entered a hospital lift on Saturday afternoon. He was rescued on Monday morning.,"Wed, 17 Jul 2024 11:36:15 GMT",2024-07-17 16:47:07.588014,"['A man from the southern Indian state of Kerala, who got trapped in a hospital lift for 42 hours without any food or water, has told the BBC he feared he would die there.Ravindran Nair, 59, entered the lift to meet a doctor on Saturday afternoon - he then remained stuck inside until Monday morning, when a lift operator found him. He is now in hospital and is being treated for dehydration and back pain. His family members initially thought he was at work, but later contacted police and began a desperate search for him.The incident has made headlines, prompting the state government to suspend three technicians and launch an inquiry. Officials from the Government Medical College, Thiruvananthapuram, and the state\'s health minister have apologised to Mr Nair.Mr Nair told the BBC that when he got trapped, he tried calling the emergency number listed in the lift but there was no response. He also tried calling his wife Sreelekha CP, who works at the hospital, and ""anyone else I could think of"", but the calls wouldn\'t connect.""I began panicking and started banging on the lift doors to attract attention. That’s when my phone fell on the floor and stopped working,"" he says.""I shouted and screamed for help and tried pulling apart the doors with my hands. It was now dark inside the lift, but thankfully, there was sufficient air to breathe.""He then paced around the lift, pressing the alarm bell again and again, hoping it would ring and catch someone\'s attention - but without any success. ""As the hours passed, I had no idea whether it was day or night as it was pitch dark inside. When I got tired, I slept in a corner. I had to use another corner to pee and poo,"" he says.', 'Mr Nair said he began visiting the hospital regularly a few months ago after he fell in the bathroom and started suffering from back pain.""On Saturday, my wife and I went to meet the doctor and I got an X-ray scan done of my back because I was experiencing severe pain after a recent trip,"" he recalls. When the doctor asked to see the results from his blood test, the couple realised that they had forgotten them at home. Since Ms Sreelakha had to report for work, Mr Nair went home to pick up the results. Normally when he visits the hospital he and his wife use a lift earmarked for employees. But this time he stepped into Lift-11 - meant for patients and visitors - to head up to the second floor. ""It was just past noon then. There was no-one else in the lift but the light was on, so I didn\'t think anything was wrong,"" he says.He pressed the button and the lift began ascending but as it neared the second floor, it lurched downwards with a thud and got stuck between the first and second floors.He didn\'t know then that his ordeal would last nearly two days. At some point he remembered he had to take pills to keep his blood pressure under control. ""I had them on me, but couldn’t swallow them because I had no water and my mouth was dry from shouting for help,"" he recalls.""I started wondering whether I would die inside the lift. I worried about my wife and children and thought about my late parents and ancestors. But then, I somehow willed myself to be stronger and told myself that I had to overcome this frightening ordeal.""One thing that gave him comfort, he says, was reciting poems written by his wife. ""I held on to the hope that someone would come along to repair the lift and find me there.""Help arrived finally on Monday morning at around 06:00 local time when an operator opened the door and asked him to jump out - 42 hours after his ordeal began.Once Mr Nair was rescued, the first thing he did was call his wife, who had no idea her missing husband was trapped at her workplace.""He wanted me to come and take him home,"" she says.The hospital has since put up a warning outside the lift asking people not to use it while it is being repaired.']"
'He will unite us' - Trump’s ex-rivals praise him,https://www.bbc.com/news/videos/cq5jwkzxdk8o#2,Nikki Haley and Ron DeSantis who both previously vied to be the party's nominee voiced support for Trump at convention.,"Wed, 17 Jul 2024 04:08:49 GMT",2024-07-17 16:47:07.588264,
Drake's Toronto home 'The Embassy' hit by floods,https://www.bbc.com/news/videos/cpd97p33y4jo#2,"The Canadian rapper joked on Instagram that the rushing floodwaters ""better be espresso martini"".","Tue, 16 Jul 2024 23:53:59 GMT",2024-07-17 16:47:07.588484,
The mountain area where Jay Slater search ended,https://www.bbc.com/news/videos/c4ng77n1r3ro#2,Spanish officials confirm a body found during the search for Jay Slater is that of the missing teen.,"Tue, 16 Jul 2024 15:19:53 GMT",2024-07-17 16:47:07.588687,
Spain team chant 'Gibraltar is Spanish' at Euros celebration,https://www.bbc.com/news/videos/c10lq8njge5o#2,Spain won Euro 2024 in a match against England on Sunday and returned to Madrid for a celebration.,"Tue, 16 Jul 2024 11:49:07 GMT",2024-07-17 16:47:07.588891,
Wild cheers at convention as Trump makes first outing since attack,https://www.bbc.com/news/videos/c51ydm3zy50o#2,Donald Trump makes his first public appearance since being shot in an assassination attempt.,"Tue, 16 Jul 2024 02:55:24 GMT",2024-07-17 16:47:07.589097,
Smoke on the horizon - Israel and Hezbollah edge closer to all-out war,https://www.bbc.com/news/articles/cz5r18zm7lpo#3,"A summer war with the Lebanese group is threatening to erupt, Orla Guerin reports.","Wed, 17 Jul 2024 05:01:47 GMT",2024-07-17 16:47:07.589300,"['As the war in Gaza grinds on, there are growing fears another Middle East war may erupt - with devastating consequences for the region, and beyond.Israel and the Lebanese armed group Hezbollah (backed by Iran) have been trading fire across their shared border for the past nine months. If this conflict escalates to all-out war, it could dwarf the destruction in Gaza, draw in Iranian-backed militias in Iraq, Syria and Yemen, spread embers around the Middle East and embroil the US. Iran itself could intervene directly.The United Nations has warned of a “catastrophe beyond imagination”.For now, a low-level war simmers in the summer heat, along a 120km (75 mile) stretch of border. One spark here could set the Middle East alight.', 'Over the lapping of the waves, and the thwack thwack of paddle games on the beach, a sound cuts through - a sudden deep boom.Soon smoke billows from a hillside in the distance after an Israeli strike.Around the pool in a resort hotel, a few sunbathers stand briefly to scan the horizon.Others don’t move a tanned limb.Explosions are part of the sound of summer 2024 in the ancient Lebanese city of Tyre, as Hezbollah and Israel exchange fire across the border 25 kilometres (15 miles) away.“Another day, another bomb,” says Roland, 49, with a shrug, as he relaxes on a lilo. He lives abroad but is back home on holiday.“We got used to it somehow over the months,” says his friend Mustafa, 39, “though children are still a little bit scared.” He nods towards his daughter Miral, 7, who is dripping wet from the pool.“When she hears an explosion, she always asks, ‘will there be a bomb now?’” he says.', 'Earlier this month, there was a massive blast in his neighbourhood in Tyre, as his family of four were having a meal. Israel had assassinated a senior Hezbollah commander, Mohammed Nimah Nasser.“We heard the noise,” Mustafa says, “and we carried on eating.”But the sunbathers on the beach in Tyre may be on borrowed time. This city will be in the firing line in the event of all-out war, along with the rest of southern Lebanon, a Hezbollah stronghold.We are now at the water’s edge of a potentially devastating war which both sides say they don’t want. Iran doesn’t seem to want it either.How did we get here?', 'On October 8th last year – one day after Hamas gunmen stormed out of Gaza and killed about 1,200 Israelis as well as taking 251 others hostage – Hezbollah joined in, firing at Israeli targets from Lebanon.The Shia Islamist armed group said it was acting in support of Gaza.Soon Israel was firing back.Hezbollah, which is also a political party, is the most powerful force in Lebanon.Like Hamas, it is classed as a terrorist organisation by many countries, including the UK and the US.But unlike Hamas, Hezbollah has the firepower to seriously threaten Israel.It is believed to have an arsenal of more than 150,000 rockets and missiles - some precision-guided - capable of inflicting heavy damage around the country.What is Hezbollah in Lebanon and will it go to war with Israel?Put simply Hezbollah - its English translation, the Party of God - has more arms than many countries.Its backer Iran – which denies Israel’s right to exist – is happy to train and fund the enemies of the Jewish state.The conflict has been heating up, with thousands of cross-border strikes.Some countries have already told their nationals to leave Lebanon urgently, including Germany, the Netherlands, Canada and Saudi Arabia. The UK has advised against all travel to the country and is urging Britons who are here to leave - while they still can.So far, both sides are mainly striking military targets, close to the border -  staying within familiar red lines.', 'But here on the Lebanese side, we have seen destruction in civilian areas with scorched fields, flattened houses and abandoned villages.And the current tit-for-tat has already driven tens of thousands from their homes - more than 90,000 in Lebanon and about 60,000 in Israel.Israeli officials say 33 people have been killed so far in Hezbollah attacks, mostly soldiers.Lebanon’s losses are far higher at 466, according to the Ministry of Health here. Most of the dead were fighters.Sally Skaiki was not.', '“I never called her Sally,” says her father Hussein Abdul Hassan Skaiki. “I always called her ‘my life’ - she was everything for me.”“She was the only girl in the house, and we spoiled her, me and her three brothers.”Sally, 25, was a volunteer paramedic. She was killed by an Israeli strike after sunset on 14 June as she stood in the doorway of her building.Her father wears the black of mourning, and the green scarf of the Shia Amal movement, which is allied to Hezbollah.', 'We meet in his village of Deir Qanoun En-Naher, 30km (18 miles) from the border. The main road is dotted with sun-bleached posters of fighters killed in battle against Israel - some in recent months, others back in 2006 when the two sides last went to war.In that conflict, Hezbollah fought Israel to a standstill but at huge cost to Lebanon and its people. There was massive destruction, and more than 1,000 Lebanese civilians were killed - according to official figures - along with an unconfirmed number of Hezbollah fighters.Israel’s death toll was 160, according to the government, most of them soldiers.By Hussein’s side there is a large poster of Sally, in her headscarf and paramedic uniform. He speaks of his daughter with pride and with anguish.“She loved to help people,” he says. “Any problem that happened, she rushed there. She was well-loved in the village. She always had a smile on her face.”As we speak there is a loud boom which rattles the windows.Hussein says it is a normal, daily occurrence.“Since a long time, Israel killed our people here,” he says.“We can’t forgive them. There is no hope of peace with them.”This time, there is no death or destruction. Instead, Israeli warplanes are breaking the sound barrier to spread fear.And, since October, Israel has been spreading something else in southern Lebanon - choking, searing clumps of white phosphorus, contained in munitions.', 'The chemical substance ignites immediately on contact with oxygen. It sticks to skin and clothing and can burn through bone, according to the World Health Organization.Moussa al-Moussa - a farmer stooped by his 77 years - knows only too well.He says Israel fired white phosphorous shells at his land in the village of al-Bustan every day for over a month, robbing him of breath, and his livelihood.“I had my scarf on, and I wrapped it around my mouth and nose until I was brought to the hospital,” he tells me, gesturing to the red and white keffiyeh – the traditional Arab scarf - on his head.“We didn’t have any masks.  I couldn’t breathe. I couldn’t see a metre in front of me. And if you touch a fragment a week later it will ignite and burn again.”The international campaign group, Human Rights Watch, has verified the use of white phosphorus over several populated areas in southern Lebanon, including al-Bustan.It says Israel’s use of white phosphorus is “unlawfully indiscriminate in populated areas”.The Israel Defense Forces (IDF) dispute this, saying the use of white phosphorus shells to create a smokescreen “is lawful under international law”.  It says these shells are not used in densely populated areas “with certain exceptions”.', 'Like many farmers along the border, Moussa fears Israel has poisoned his tobacco crop and his olive groves.“White phosphorous burns the ground, it burns people and the crops and buildings,” he says.Even if he can return home, he is afraid to bring in a harvest in case it harms his family or his buyers.He lives in limbo - in classroom 4B of a vocational school in Tyre. About 30 families who fled the border area are sheltering in the building. Washing is strung across the school yard. A lone little boy races up and down the empty corridors on a bicycle.When I ask Moussa how many wars he has seen, he begins to laugh.“We spent our lives in wars,” he says. “Only God knows if another one is coming.”', 'As one of Hezbollah’s most senior commanders, Mohammed Nimah Nasser, was a wanted man. He fought Israel in 2006, and before, and went on to fight in Syria and Iraq. In recent months he “planned, led and supervised many military operations against the Israeli enemy”, according to Hezbollah.Israel tracked him down in Tyre on 3 July. Death came from the sky in broad daylight, with an air strike which turned his car into a fireball.In the Hezbollah stronghold of south Beirut, he was given a hero’s funeral, or rather a “martyr’s” one.The event was carefully choreographed and strictly segregated - men in one area, women in another - including the press.His coffin, draped in the yellow flag of Hezbollah, was carried by pall bearers in camouflage uniforms and red berets. Many more fighters stood to attention, lines deep. There was a brass band in spotless white uniforms, if not in perfect harmony.It had the feel of a state funeral - in a country that lacks a functioning state.Lebanon has no president, a caretaker government and a shattered economy. It is carved up by sect, and hollowed out by corruption, its citizens left to fend for themselves. Many Lebanese are weary. The last thing they want is another war.But as the funeral prayers concluded, the talk among mourners was of “martyrdom” not death, and of readiness for war, if it comes.', 'Hassan Hamieh, a 35-year-old nurse, told us he would fight. “We are not afraid,” he said.“In fact, we are longing for an all-out war. Martyrdom is the shortest path to God. Young or old, we will all take part in this war, if it is forced upon us.”Hezbollah’s leader, Hassan Nasrallah, has stressed the armed group is ready, but not eager, for war. He says if there is a ceasefire agreed in Gaza, Hezbollah will cease fire too, immediately.Will that satisfy Israel? Maybe not.It sees Hezbollah as a permanent threat too close for comfort. At the very least, it wants its heavily armed enemy to pull back from the border.There have been plenty of bellicose threats. Israel’s Education Minister, Yoav Kish, said Lebanon would be “annihilated”. Defence Minister Yoav Gallant chimed in, saying the country would be returned “to the stone age”.As the attacks and counter attacks continue, families are destroyed. This month parents have been ripped from children, and children from parents.An Israeli couple were killed in their car by Hezbollah rockets as they headed for home in the Israeli-occupied Golan Heights in Syria. They left behind three teenage children. And in southern Lebanon three children were killed in an Israeli strike earlier this week. They were aged between four and eight, and their parents were Syrian farm workers.The IDF approved “operational plans for an offensive in Lebanon” a month ago.For now, no tanks are rolling over the border. There has been no political decision to attack. Israel is still waging war in Gaza and fighting on two fronts could overstretch the military.But without a diplomatic solution between Israel and Hezbollah - two old enemies - all-out war may be coming, if not now, then later.Additional reporting by Goktay Koraltan and Ghassan Ibraheem']"
'They killed my son' - raw grief after Nigeria school collapse,https://www.bbc.com/news/articles/c4ngppnl724o#3,"Government promises to curb rogue building practices are too little, too late for grieving parents.","Wed, 17 Jul 2024 11:14:43 GMT",2024-07-17 16:47:07.589496,"['Jotted down on paper, this playful story about a lazy lion is now a memento of a young life lost.Chidera Onovo, 15, was a caring boy who loved to draw and was his mother’s unabashed favourite.""He saved up his lunch money to buy biscuits to share with his siblings,"" Blessing Onovo recalls. ""And he was always the one who noticed my moods and would ask: \'Mummy are you fine?\'.""Last Friday morning Chidera went to secondary school with his younger sister Chisom but only one of them would return.Official reports from the Nigerian government say 22 students were killed in the building collapse at Saints Academy, a private school in the central city of Jos, but local residents say the number is closer to 50. Using their bare hands and shovels, parents desperately searched for survivors, managing to tunnel through and free some of the trapped children. ""It took about an hour before an excavator came,"" says Chidera’s father, Chike Michael Onovo.""I saw my daughter Chisom being dragged out. I was relieved, but I kept shouting: \'Where is Chidera my son?\'."" The boy\'s body was later found, crushed by the fallen concrete in his classroom on the first floor.', 'Also searching frantically that day was 43-year-old Victor Dennis. His worst fears were confirmed a day later when he found his son Emmanuel’s lifeless body at a local morgue.""My boy was a good boy,"" he tells the BBC. ""He didn’t deserve to die. They killed my son. He didn’t do anything wrong. He just went to school to learn.""', 'Tears fall from Mr Dennis\' bloodshot eyes as mourners sing a farewell hymn at his son’s burial. Absent is his wife, Emmanuel’s mother, who is inconsolable with grief and stays at home.People in Jos have rallied to support one another, and many young lives have been saved thanks to blood donors who have visited local hospitals.But there is anger and disbelief that yet another building collapse has been allowed to happen in Nigeria. Residents even claim the children had felt the building shake the day before.""Substandard materials were used -\u202fthese could have been responsible for the collapse of the building,"" says regulator and architect Olusegun Godwin Olukoya, who leads the Nigerian Institute of Architects in Plateau state. ""Our preliminary investigations indicate that there was possible lack of adherence to building regulations.""He is scathing in his criticism of builders and the Nigerian authorities, telling the BBC:""Unfortunately, due to the kind of society that we live in, lack of will has prevented the authorities from adopting our suggestions in the past. ""People cut corners and when you try to raise alarm, some feel that you are trying to victimise or oppress them. They use their people in positions of authority to circumvent the rules.""', 'Following the building collapse at Saints Academy, the local governor has ordered a structural audit of all schools and public buildings in Plateau state, of which Jos is the capital. Officials in his government say it is not clear whether the school’s owner, who has since died, ever had a construction permit for the site.The BBC was unable to get comment from the school\'s management.Some also suspect that mining activity close by could have damaged the school building, so the governor has also ordered the arrest of any artisanal miners found digging in residential areas in the state.But officials suspect that the main problem was with how the school was built.""Even as a layman who is not a building professional, you can see that the materials used in the construction are not standard. But we will investigate the cause of the collapse and punish those found culpable,"" Musa Ashom, the state Commissioner for Information, tells the BBC.Similar promises came from Nigeria\'s Housing Minister, Ahmed Dangiwa, who spoke scathingly of ""unscrupulous"" individuals whose actions he said had resulted in the Jos school collapse and caused unquantifiable loss.But those words will come as little consolation to the many bereft families, like that of Chinecherem Joy Emeka.The 13-year-old was one of the best dancers at her school and dreamed of becoming a doctor one day, says her mother Blessing Nwabuchi.Chinecherem, or Chi Chi as loved ones called her, was sitting her end-of-year exams the day she died.Photos like this one, from her junior high graduation last year, are precious reminders of what she achieved - and everything she might have gone on to become.', ""Should I stay or should I go? The dilemma for young NigeriansAfrica’s richest man says he doesn’t own a home outside NigeriaCelebrating 50 years of marriage in Nigeria’s 'divorce capital'Brave, inspiring, crazy - the joy of managing Fela KutiThe Nigerian queer parties that offer liberation"", 'Go to BBCAfrica.com for more news from the African continent.Follow us on Twitter @BBCAfrica, on Facebook at BBC Africa or on Instagram at bbcafrica']"
